{"candidate_id":"dm:memory-candidate:v1:j-zM7ID0xV-n83VBWvgqpWurnmbVmTPukVCxW-yaqk8","checkpoint":{"being_ref":"dm:being:v1:rXPS-dJw3Inkmla3gM_RAckdAmqw4If5htSQnP_d03g","body_evidence_state":"verified","captured_at_ms":1800000000000,"evidence_refs":["10000000-0000-4000-8000-000000000030"],"lane_event_ids":[],"lane_head":null,"lane_state":"empty","ledger_state_hash":"caedbdec58333a2a5b1f5828846a17fc29616c94a59bb9a3afd6b111efe1a9c7","local_origin":{"body_ref":"cluster:vector:compaii","embodiment_id":"embodiment:vector","incarnation_id":"incarnation:vector:0","principal_id":"compaii@vector"},"manifest_hash":"e7aedab24df9c9aa59be047537f703720b5684b3c37eab9ad8c82a1e91d2569d","projection_hash":"e02a16be4b70857e139e12205a6814a3867ca4975bb2499bed5003c113940e4d","schema":"dm.memory.checkpoint/v1"},"decision_id":"dm:memory-decision:v1:l2AcZWhsk6Vt80GBFLpl42ta-jmppWAYcdus0AM4kHQ","evaluated_at_ms":1800000000000,"expires_at_ms":1800000300000,"outcome":"eligible","policy_id":"dm:memory-policy:v1:sb0xj-M0SB-rgFySwoRICNHWORHhmQcds8uVVQpxzCk","predecessor_decision_id":null,"reasons":[],"schema":"dm.memory.policy-decision/v1","subject_me_id":"dm:being:v1:rXPS-dJw3Inkmla3gM_RAckdAmqw4If5htSQnP_d03g"}
